{
  "$schema": "https://json-schema.org/draft/2020-12/schema",
  "$id": "https://fiduciary-wire/schemas/digest.schema.json",
  "title": "digest.json / digests/<date>.json",
  "description": "The current Top Stories / digest (digest.json) and archived AI digests (digests/YYYY-MM-DD.json). ai=false means no valid AI digest for this refresh: items are the plain ranked list with null summaries.",
  "type": "object",
  "properties": {
    "schema_version": {
      "const": 1
    },
    "date": {
      "type": "string",
      "pattern": "^\\d{4}-\\d{2}-\\d{2}$"
    },
    "generated_at": {
      "type": "string",
      "pattern": "^\\d{4}-\\d{2}-\\d{2}T\\d{2}:\\d{2}:\\d{2}Z$"
    },
    "ai": {
      "type": "boolean"
    },
    "opener": {
      "type": [
        "string",
        "null"
      ]
    },
    "items": {
      "type": "array",
      "items": {
        "type": "object",
        "properties": {
          "cluster_id": {
            "type": "integer",
            "minimum": 0
          },
          "headline": {
            "type": "string"
          },
          "url": {
            "type": "string",
            "pattern": "^https?://"
          },
          "category": {
            "type": "string",
            "minLength": 1
          },
          "outlet_count": {
            "type": "integer",
            "minimum": 1
          },
          "sources": {
            "type": "array",
            "items": {
              "type": "object",
              "properties": {
                "name": {
                  "type": "string"
                },
                "url": {
                  "type": "string",
                  "pattern": "^https?://"
                }
              },
              "required": [
                "name",
                "url"
              ],
              "additionalProperties": false
            }
          },
          "firms": {
            "type": "array",
            "items": {
              "type": "object",
              "properties": {
                "name": {
                  "type": "string"
                },
                "slug": {
                  "type": [
                    "string",
                    "null"
                  ],
                  "pattern": "^[a-z0-9-]+$"
                }
              },
              "required": [
                "name",
                "slug"
              ],
              "additionalProperties": false
            }
          },
          "aum_usd": {
            "type": [
              "number",
              "null"
            ]
          },
          "aum_source": {
            "enum": [
              "headline",
              "sec",
              null
            ]
          },
          "summary": {
            "type": [
              "string",
              "null"
            ]
          },
          "why_it_matters": {
            "type": [
              "string",
              "null"
            ]
          },
          "industries": {
            "type": "array",
            "items": {
              "type": "string"
            },
            "minItems": 1
          },
          "deal": {
            "type": [
              "object",
              "null"
            ],
            "additionalProperties": false,
            "required": [
              "acquirer",
              "target",
              "type",
              "stage",
              "value_usd"
            ],
            "properties": {
              "acquirer": {
                "type": [
                  "string",
                  "null"
                ]
              },
              "target": {
                "type": [
                  "string",
                  "null"
                ]
              },
              "type": {
                "enum": [
                  "acquisition",
                  "stake",
                  "merger",
                  "recapitalization",
                  null
                ]
              },
              "stage": {
                "enum": [
                  "announced",
                  "completed",
                  "rumored",
                  "bid",
                  "terminated"
                ]
              },
              "value_usd": {
                "type": [
                  "number",
                  "null"
                ]
              }
            }
          }
        },
        "required": [
          "cluster_id",
          "headline",
          "url",
          "category",
          "outlet_count",
          "sources",
          "firms",
          "aum_usd",
          "aum_source",
          "summary",
          "why_it_matters"
        ],
        "additionalProperties": false
      }
    },
    "more": {
      "type": "array",
      "items": {
        "type": "object",
        "properties": {
          "cluster_id": {
            "type": "integer",
            "minimum": 0
          },
          "headline": {
            "type": "string"
          },
          "url": {
            "type": "string",
            "pattern": "^https?://"
          },
          "category": {
            "type": "string",
            "minLength": 1
          },
          "outlet_count": {
            "type": "integer",
            "minimum": 1
          },
          "sources": {
            "type": "array",
            "items": {
              "type": "object",
              "properties": {
                "name": {
                  "type": "string"
                },
                "url": {
                  "type": "string",
                  "pattern": "^https?://"
                }
              },
              "required": [
                "name",
                "url"
              ],
              "additionalProperties": false
            }
          },
          "firms": {
            "type": "array",
            "items": {
              "type": "object",
              "properties": {
                "name": {
                  "type": "string"
                },
                "slug": {
                  "type": [
                    "string",
                    "null"
                  ],
                  "pattern": "^[a-z0-9-]+$"
                }
              },
              "required": [
                "name",
                "slug"
              ],
              "additionalProperties": false
            }
          },
          "aum_usd": {
            "type": [
              "number",
              "null"
            ]
          },
          "aum_source": {
            "enum": [
              "headline",
              "sec",
              null
            ]
          },
          "summary": {
            "type": [
              "string",
              "null"
            ]
          },
          "why_it_matters": {
            "type": [
              "string",
              "null"
            ]
          },
          "industries": {
            "type": "array",
            "items": {
              "type": "string"
            },
            "minItems": 1
          },
          "deal": {
            "type": [
              "object",
              "null"
            ],
            "additionalProperties": false,
            "required": [
              "acquirer",
              "target",
              "type",
              "stage",
              "value_usd"
            ],
            "properties": {
              "acquirer": {
                "type": [
                  "string",
                  "null"
                ]
              },
              "target": {
                "type": [
                  "string",
                  "null"
                ]
              },
              "type": {
                "enum": [
                  "acquisition",
                  "stake",
                  "merger",
                  "recapitalization",
                  null
                ]
              },
              "stage": {
                "enum": [
                  "announced",
                  "completed",
                  "rumored",
                  "bid",
                  "terminated"
                ]
              },
              "value_usd": {
                "type": [
                  "number",
                  "null"
                ]
              }
            }
          }
        },
        "required": [
          "cluster_id",
          "headline",
          "url",
          "category",
          "outlet_count",
          "sources",
          "firms",
          "aum_usd",
          "aum_source",
          "summary",
          "why_it_matters"
        ],
        "additionalProperties": false
      }
    },
    "model_note": {
      "type": "string"
    },
    "window_start": {
      "type": "string",
      "pattern": "^\\d{4}-\\d{2}-\\d{2}T\\d{2}:\\d{2}:\\d{2}Z$"
    },
    "last_good_digest": {
      "anyOf": [
        {
          "type": "object",
          "properties": {
            "date": {
              "type": "string",
              "pattern": "^\\d{4}-\\d{2}-\\d{2}$"
            },
            "path": {
              "type": "string"
            }
          },
          "required": [
            "date",
            "path"
          ],
          "additionalProperties": false
        },
        {
          "type": "null"
        }
      ]
    },
    "footer_note": {
      "type": "string"
    }
  },
  "required": [
    "schema_version",
    "date",
    "generated_at",
    "ai",
    "opener",
    "items",
    "more"
  ],
  "additionalProperties": false
}
